ID,Topics
CVE-2017-5087,"databases, bypassing restrictions, pointers, UI"
CVE-2017-5088,"bounds checking, UI, confidentiality"
CVE-2017-5089,"spoofing, character encodings, mac"
CVE-2017-5091,"use-after-free, memory, databases, pointers"
CVE-2017-5092,"use-after-free, memory, IPC, denial of service, availability"
CVE-2017-5093,"spoofing, browsers, popups, UI, input validation, confidentiality, design mistake"
CVE-2017-5094,"type confusion, extensions"
CVE-2017-5095,"bounds checking, PDF, complex inputs"
CVE-2017-5096,"confidentiality, android, URL"
CVE-2017-5097,"bounds checking, UI"
CVE-2017-5098,"use-after-free, memory, UI"
CVE-2017-5099,"bypassing restrictions, integrity, elevation of privilege"
CVE-2017-5100,"use-after-free, browsers"
CVE-2017-5101,"URL, spoofing"
CVE-2017-5102,"memory, UI"
CVE-2017-5103,"UI, memory"
CVE-2017-5104,"UI, spoofing, mac"
CVE-2017-5105,"URL, spoofing"
CVE-2017-5106,"spoofing, URL, fonts"
CVE-2017-5107,"confidentiality, images, XML, iframes, side-channel attacks, URL, origin policy, complex inputs"
CVE-2017-5108,type confusion
CVE-2017-5109,"UI, spoofing, browsers, javascript"
CVE-2017-5110,"UI, spoofing, origin policy, "
CVE-2017-5111,"use-after-free, memory, PDF, complex inputs"
CVE-2017-5112,"UI, buffer overflow, memory"
CVE-2017-5113,"buffer overflow, UI"
CVE-2017-5114,"memory, PDF, complex inputs"
CVE-2017-5115,type confusion
CVE-2017-5116,type confusion
CVE-2017-5117,"memory, UI"
CVE-2017-5118,bypassing restrictions
CVE-2017-5119,"UI, memory"
CVE-2017-5120,HTTP
CVE-2017-5121,bounds checking
CVE-2017-5122,"bounds checking, javascript, C"
CVE-2017-5124,XSS
CVE-2017-5125,"buffer overflow, UI"
CVE-2017-5126,"use-after-free, memory, PDF, complex inputs"
CVE-2017-5127,"use-after-free, PDF, complex inputs"
CVE-2017-5128,"buffer overflow, API, complex inputs, UI"
CVE-2017-5129,"use-after-free, audio, complex inputs"
CVE-2017-5130,"buffer overflow, memory, XML, complex inputs"
CVE-2017-5131,"bounds checking, UI"
CVE-2017-5132,buffer overflow
CVE-2017-5133,"bounds checking, UI"
CVE-2017-5638,"code execution, exception handling"
CVE-2017-5648,"integrity, HTTP requests, confidentiality, design mistake, permissions"
CVE-2017-5650,"denial of service, HTTP requests, availability, resource exhaustion, threads, design mistake, insufficient testing, edge cases"
CVE-2017-5651,"HTTP requests, confidentiality, cache, threads"
CVE-2017-6991,"pointers, memory, SQL, databases"
CVE-2017-7659,"linux, HTTP requests, pointers, memory, denial of service, availability, bounds checking"
CVE-2017-7668,"buffer overflow, memory, C, integrity"
CVE-2017-7672,"URL, form, input valiation, denial of service, availability, regular expressions, design mistake, insufficient testing"
CVE-2017-7674,"origin policy, CORS, cache, bypassing restrictions, design mistake"
CVE-2017-7675,"URL, complex inputs, insufficient testing"
CVE-2017-7679,"metadata, character encodings, mimetypes, buffer overflow, denial of service, availability, integrity, confidentiality"
CVE-2017-9787,"proxies, denial of service, availability, design mistake, permissions"
CVE-2017-9791,"command injection, SQL injection, databases"
CVE-2017-9793,"extensions, serialization, XML, denial of service, availability"
CVE-2017-9798,"configuration, confidentiality, memory, use-after-free, denial of service, availability, design mistake"
CVE-2017-9804,"insufficient testing, denial of service, availability, regular expressions"
CVE-2017-9805,"code execution, XML, input validation, design mistake, serialization, insufficient testing"
CVE-2018-11776,"code execution, input validation, command injection"
CVE-2018-11784,"URL, input validation"
CVE-2018-1305,"elevation of privilege, design mistake"
CVE-2018-1327,"extensions, serialization, java, denial of service, XML, distrustful decomposition, input validation"
CVE-2018-1336,"internationalization, character encodings, denial of sevice, availability, buffer overflow"
CVE-2018-8037,"race conditions, confidentiality, edge cases"
This-is-a-Test,"android, iOS, authorization"